,Questions,Answers
235,What benfits does Perstige is providing ?,"Benefits of prestige AICTE Approved/ RGPV Affiliated/ NBA Accredited for CSE & ECE In 2020 CE & EE & ME applying for NBA accreditation Participated in NIRF & ARIIA Ranking of MHRD, Govt. of India. Experience qualified faculty, Staff, Strong focus on teaching, skill development & All round development of student. Many faculty and Ph.D. and qualified from IIT/IISc or reputed universities.Faculty are also involved in research and consultancy. Advance Laboratories and Center of Excellences are existing.Very good Placement record and support for Entrepreneurship."
236,Tell me better college to enrolled for  ?,"Any Good College should have 3F- Faculty, Facilities & Forums"
237,Show me the list of seats available for M.Tech?,Available seat for  M.Tech (CAD/CAM)  is18
238,Show me the list of seats available for B.Tech?,"Available seats in B.Tech (Automation & Robotics 60, AI & DS 60, CE- 60, CSE-180, EC- 60, EE-60, ME-60)"
239,Show me the list of seats available for Diploma?,Available seats in diploma ME-60
240,What benefits are there if I will choose Engineering ?,"there are lots of benefits of doing engineering some of that are Job Satisfaction,Variety of Career Opportunities,Potential to Benefit Society,Challenging Work,Creative Thinking,Technological and Scientific Discovery etc.."
241,How can I apply for M Tech ?,"You can go through the DTE Counseling Website and follow the following steps 1. Registration, 2. Document Verification,3. Choice Filling, 4. Allotment , 5. Reporting to Institute."
242,How can I apply for B Tech ?,"You can go through the DTE Counseling Website and follow the following steps 1. Registration, 2. Document Verification,3. Choice Filling, 4. Allotment , 5. Reporting to Institute."
243,How can I apply for Diploma ?,"You can go through the DTE Counseling Website and follow the following steps 1. Registration, 2. Document Verification,3. Choice Filling, 4. Allotment , 5. Reporting to Institute."
244,What's qualification required for  BTech ?,"JEE-Main & 12th Class passed with PCM Marks must be 120 for SC/ST, OBC & 135 for others required"
245,What's qualification required for Diploma  ?,"for Diploma, PPT Score Card & 10th Class Passed is required"
246,Did Perstige offers any Scholarship ?,"Yes, Chhavi Jain Scholarship for Meritorious Students"
247,What is the semester wise fee for M. Tech ?,35000/- Per Sem *** Likely to increase as per AFRC Govt. of MP
248,What is the semester wise fee for B. Tech ?,"For B.Tech- (CSE, AI&DS, Robotics) - 36000/- per Sem, (CE, EC, EE, ME) - 32000/- per Sem*** Likely to increase as per AFRC Govt. of MP"
249,What is the semester wise fee for Diploma ?,For Diploma (ME) 20000/- per sem*** Likely to increase as per AFRC Govt. of MP
250,Do Prestige have bus facilites outside the Indore ?,"Yes, Available"
251,What is semester wise bus fee ?,"You have to pay yearly Fee. For Indore 10000/- per yearFor Dewas, Mhow, Pithampur 12000/- per year"
252,How much far is Prestige College from Geeta Bhavan.?,Near About 4 to 5 Km
253,Please tell me all the facilites which are provide by prestige ?,"Facilities provided by Prestige are Training, Cocubes Training, Internship, Industrial Visit, IIC, E-Cell, LMS-(Moodle), Acc-Soft for Online Attendance, Sports Facility, Extracurricular activity & Basic Facilities like - Light, Water, Solar Power Plant, Rain Water Harvesting, Electricity Generator, Well Equipped Labs, WiFi-Internet 70MBPS leased line, Lift, Auditorium, Girls Common Room etc. Green Lawn, Playground"
254,How far is the  College from Hostel. ?,"Walking Distance,"
